rank,Category,Indicator,Policy,Country,ISO,value,unit,year
1,Demographics,Individuals using the Internet,E1_Income support,Gambia,GMB,19.8365,percent of population,2019.0
3,Governance,Regulatory quality estimate,E1_Income support,Gambia,GMB,-0.6649198,score,2019.0
4,Health,Prevalence of COVID-19,E1_Income support,Gambia,GMB,3786.0,"Number (cumulative total by Dec 26,2020)",2020.0
5,Health,Prevalence of Hypertensive heart disease,E1_Income support,Gambia,GMB,0.000957,percent,2019.0
7,Demographics,Fixed telephone subscriptions,E1_Income support,Gambia,GMB,44000.0,number,2019.0
9,Social issues ,Gini index (World Bank estimate),E1_Income support,Gambia,GMB,35.9,index ,2015.0
10,Economics,Volume of imports,E1_Income support,Gambia,GMB,6.299,percent change,2020.0
12,Economics,"Labor force participation rate, total (% of total population ages 15+) (modeled ILO estimate)",E1_Income support,Gambia,GMB,59.5550003,Percentage of total population,2020.0
13,Health,Prevalence of total cancers,E1_Income support,Gambia,GMB,0.001556,percent,2019.0
14,Social issues ,Life Ladder ,E1_Income support,Gambia,GMB,5.051000118255615,score,2021.0
15,Demographics,Fixed broadband subscriptions,E1_Income support,Gambia,GMB,0.194422,per 100 people,2019.0
17,Demographics,Secure Internet servers ,E1_Income support,Gambia,GMB,22.1492810428563,per 1 million people,2019.0
18,Governance,Rule of law estimate ,E1_Income support,Gambia,GMB,-0.3715761,score,2019.0
19,Economics,Volume of exports,E1_Income support,Gambia,GMB,11.415,percent change,2020.0
20,Social issues ,Net migration,E1_Income support,Gambia,GMB,-15436.0,net total / data are 5 year estimates,2019.0
21,Health,Prevalence of Respiratory infections and tuberculosis,E1_Income support,Gambia,GMB,0.198757,percent,2019.0
22,Health,"Immunization, DPT (% of children ages 12-23 months)",E1_Income support,Gambia,GMB,88.0,percent,2019.0
23,Economics,"Unemployment, total (% of total labor force) (modeled ILO estimate)",E1_Income support,Gambia,GMB,9.10700035,percent of total labor force,2020.0
24,Social issues ,Press freedom score,E1_Income support,Gambia,GMB,30.62,score,2020.0
25,Demographics,Mobile cellular subscriptions,E1_Income support,Gambia,GMB,139.529,per 100 people,2019.0
29,Governance,Control of corruption estimate,E1_Income support,Gambia,GMB,-0.2852226,score,2019.0
30,Health,Domestic General Government Health Expenditure (GGHE-D) as % General Government Expenditure (GGE),E1_Income support,Gambia,GMB,0.9,percent,2018.0
31,Health,"Physicians (per 1,000 people)",E1_Income support,Gambia,GMB,0.1021,Ones,2015.0
32,Health,"Incidence of tuberculosis (per 100,000 people)",E1_Income support,Gambia,GMB,158.0,Cases,2019.0
33,Environment,Renewable energy consumption ,E1_Income support,Gambia,GMB,51.5088624939659,percent of total final energy consumption,2015.0
35,Health,Prevalence of anxiety disorders,E1_Income support,Gambia,GMB,0.032372,percent,2019.0
36,Governance,Aggregate score for the Political Rights category,E1_Income support,Gambia,GMB,20.0,score,2021.0
37,Environment,CO2 emissions (kt),E1_Income support,Gambia,GMB,531.715,kt,2016.0
39,Health,Mortality due to COVID-19,E1_Income support,Gambia,GMB,123.0,"Number (cumulative total by Dec 26,2020)",2020.0
40,Governance,Human Freedom Score ,E1_Income support,Gambia,GMB,6.27,score,2018.0
44,Environment,"Adjusted net savings, including particulate emission damage",E1_Income support,Gambia,GMB,-7.83852285258373,percent of GNI,2018.0
45,Health,"Prevalence of HIV, total (% of population ages 15-49)",E1_Income support,Gambia,GMB,1.9,percent,2019.0
46,Governance,Fragile States Index Total ,E1_Income support,Gambia,GMB,82.21463956781182,score,2020.0
47,Environment,"PM2.5 air pollution, population exposed to levels exceeding WHO guideline value ",E1_Income support,Gambia,GMB,100.0,percent of total,2017.0
49,Governance,"CPIA transparency, accountability, and corruption in the public sector rating (1=low to 6=high)",E1_Income support,Gambia,GMB,2.5,rating,2019.0
50,Health,Prevalence of Depressive disorders,E1_Income support,Gambia,GMB,0.042125,percent,2019.0
51,Governance,Corruption Perceptions Index,E1_Income support,Gambia,GMB,37.0,score,2020.0
53,Health,"Prevalence of overweight (modeled estimate, % of children under 5)",E1_Income support,Gambia,GMB,2.3,percent,2020.0
54,Health,Prevalence of obesity,E1_Income support,Gambia,GMB,10.3,percent,2016.0
55,Health,Summary exposure value tobacco,E1_Income support,Gambia,GMB,20.67008,Rate (risk-weighted prevalence),2019.0
57,Health,"Prevalence of stunting, height for age (modeled estimate, % of children under 5)",E1_Income support,Gambia,GMB,16.1,percent,2020.0
63,Economics,Employment in services (% of total employment) (modeled ILO estimate),E1_Income support,Gambia,GMB,57.6599998,Percentage of total employment,2020.0
64,Economics,"Labor force participation rate, female (% of female population ages 15+) (modeled ILO estimate)",E1_Income support,Gambia,GMB,51.3660011,Percentage of females of the total population,2020.0
65,Health,Prevalence of down syndrome,E1_Income support,Gambia,GMB,0.000173,percent,2019.0
68,Social issues ,Proportion of seats held by women in national parliaments (%),E1_Income support,Gambia,GMB,8.620689655,proportion,2020.0
69,Health,"Immunization, measles (% of children ages 12-23 months)",E1_Income support,Gambia,GMB,85.0,percent,2019.0
70,Governance,Economic Freedom Score,E1_Income support,Gambia,GMB,7.14,score,2018.0
74,Governance,Personal Freedom Score ,E1_Income support,Gambia,GMB,5.4,score,2018.0
75,Governance,Aggregate score for the Civil Liberties category,E1_Income support,Gambia,GMB,26.0,score,2021.0
76,Health,Prevalence of chronic kidney disease,E1_Income support,Gambia,GMB,0.040879,percent,2019.0
78,Environment,"PM2.5 air pollution, mean annual exposure",E1_Income support,Gambia,GMB,33.98264,micrograms per cubic meter,2017.0
80,Health,Prevalence of Diabetes,E1_Income support,Gambia,GMB,0.020017,percent,2019.0
83,Governance,Voice and accountability estimate,E1_Income support,Gambia,GMB,-0.2162317,score,2019.0
84,Environment,CO2 emissions (metric tons per capita),E1_Income support,Gambia,GMB,0.247408,metric tons per capita,2016.0
85,Health,"Nurses and midwives (per 1,000 people)",E1_Income support,Gambia,GMB,1.5447,Ones,2015.0
86,Governance,Total freedom in the world score ,E1_Income support,Gambia,GMB,46.0,score,2021.0
88,Governance,Political stability and absence of violence/terrorism estimate,E1_Income support,Gambia,GMB,0.1114135,score,2019.0
90,Governance,Human Development Index,E1_Income support,Gambia,GMB,0.496,index,2019.0
92,Governance,Government effectiveness estimate,E1_Income support,Gambia,GMB,-0.630676,score,2019.0
117,Environment,Access to electricity ,E1_Income support,Gambia,GMB,60.3,percent of population,2018.0
