rank,Category,Indicator,Policy,Country,ISO,value,unit,year
1,Demographics,Individuals using the Internet,C4_Restrictions on gatherings,Mongolia,MNG,51.08,percent of population,2019.0
2,Health,Domestic General Government Health Expenditure (GGHE-D) as % General Government Expenditure (GGE),C4_Restrictions on gatherings,Mongolia,MNG,2.2,percent,2018.0
3,Economics,"Unemployment, total (% of total labor force) (modeled ILO estimate)",C4_Restrictions on gatherings,Mongolia,MNG,5.9460001,percent of total labor force,2020.0
4,Health,Prevalence of anxiety disorders,C4_Restrictions on gatherings,Mongolia,MNG,0.022225,percent,2019.0
5,Health,Prevalence of COVID-19,C4_Restrictions on gatherings,Mongolia,MNG,941.0,"Number (cumulative total by Dec 26,2020)",2020.0
6,Social issues ,Proportion of seats held by women in national parliaments (%),C4_Restrictions on gatherings,Mongolia,MNG,17.33333333,proportion,2020.0
7,Environment,Renewable energy consumption ,C4_Restrictions on gatherings,Mongolia,MNG,3.42973728977845,percent of total final energy consumption,2015.0
8,Health,Summary exposure value tobacco,C4_Restrictions on gatherings,Mongolia,MNG,29.20108,Rate (risk-weighted prevalence),2019.0
9,Governance,Human Freedom Score ,C4_Restrictions on gatherings,Mongolia,MNG,7.61,score,2018.0
10,Governance,Rule of law estimate ,C4_Restrictions on gatherings,Mongolia,MNG,-0.266293,score,2019.0
11,Health,Prevalence of Diabetes,C4_Restrictions on gatherings,Mongolia,MNG,0.022695,percent,2019.0
12,Economics,Volume of imports,C4_Restrictions on gatherings,Mongolia,MNG,-0.856,percent change,2020.0
13,Demographics,Fixed broadband subscriptions,C4_Restrictions on gatherings,Mongolia,MNG,9.83878,per 100 people,2019.0
14,Governance,Regulatory quality estimate,C4_Restrictions on gatherings,Mongolia,MNG,-0.011242,score,2019.0
15,Environment,CO2 emissions (metric tons per capita),C4_Restrictions on gatherings,Mongolia,MNG,8.300172,metric tons per capita,2016.0
16,Health,"Incidence of tuberculosis (per 100,000 people)",C4_Restrictions on gatherings,Mongolia,MNG,428.0,Cases,2019.0
17,Social issues ,Net migration,C4_Restrictions on gatherings,Mongolia,MNG,-4262.0,net total / data are 5 year estimates,2019.0
18,Governance,Aggregate score for the Civil Liberties category,C4_Restrictions on gatherings,Mongolia,MNG,48.0,score,2021.0
19,Governance,Total freedom in the world score ,C4_Restrictions on gatherings,Mongolia,MNG,84.0,score,2021.0
20,Demographics,Mobile cellular subscriptions,C4_Restrictions on gatherings,Mongolia,MNG,137.014,per 100 people,2019.0
21,Governance,Government effectiveness estimate,C4_Restrictions on gatherings,Mongolia,MNG,-0.1948303,score,2019.0
22,Environment,Electricity production from oil sources,C4_Restrictions on gatherings,Mongolia,MNG,4.17195719209142,percent of total,2015.0
23,Health,Prevalence of Hypertensive heart disease,C4_Restrictions on gatherings,Mongolia,MNG,0.000583,percent,2019.0
24,Environment,Electric power consumption ,C4_Restrictions on gatherings,Mongolia,MNG,2006.388880952673,kWh per capita,2014.0
25,Environment,"Adjusted net savings, including particulate emission damage",C4_Restrictions on gatherings,Mongolia,MNG,-7.48835617751419,percent of GNI,2018.0
26,Environment,Electricity production from coal sources ,C4_Restrictions on gatherings,Mongolia,MNG,92.74442227462362,percent of total,2015.0
27,Health,"Immunization, DPT (% of children ages 12-23 months)",C4_Restrictions on gatherings,Mongolia,MNG,98.0,percent,2019.0
28,Social issues ,Press freedom score,C4_Restrictions on gatherings,Mongolia,MNG,29.61,score,2020.0
29,Environment,Energy use ,C4_Restrictions on gatherings,Mongolia,MNG,166.4888384611077,"(kg of oil equivalent) per $1,000 GDP (constant 2017 PPP)",2014.0
30,Health,Prevalence of total cancers,C4_Restrictions on gatherings,Mongolia,MNG,0.004698,percent,2019.0
31,Economics,"Labor force participation rate, total (% of total population ages 15+) (modeled ILO estimate)",C4_Restrictions on gatherings,Mongolia,MNG,59.4280014,Percentage of total population,2020.0
32,Health,"Nurses and midwives (per 1,000 people)",C4_Restrictions on gatherings,Mongolia,MNG,3.8938,Ones,2018.0
33,Governance,Economic Freedom Score,C4_Restrictions on gatherings,Mongolia,MNG,7.43,score,2018.0
34,Social issues ,Gini index (World Bank estimate),C4_Restrictions on gatherings,Mongolia,MNG,32.7,index ,2018.0
35,Governance,Aggregate score for the Political Rights category,C4_Restrictions on gatherings,Mongolia,MNG,36.0,score,2021.0
36,Social issues ,"Intentional homicides (per 100,000 people)",C4_Restrictions on gatherings,Mongolia,MNG,6.1825479289,"proportion, pero 100,000 people",2018.0
37,Health,"Physicians (per 1,000 people)",C4_Restrictions on gatherings,Mongolia,MNG,2.8592,Ones,2016.0
38,Governance,Fragile States Index Total ,C4_Restrictions on gatherings,Mongolia,MNG,51.93521252189043,score,2020.0
39,Governance,Personal Freedom Score ,C4_Restrictions on gatherings,Mongolia,MNG,7.79,score,2018.0
40,Environment,"PM2.5 air pollution, population exposed to levels exceeding WHO guideline value ",C4_Restrictions on gatherings,Mongolia,MNG,97.0139805896742,percent of total,2017.0
41,Social issues ,Life Ladder ,C4_Restrictions on gatherings,Mongolia,MNG,5.677199840545654,score,2021.0
42,Environment,CO2 emissions (kt),C4_Restrictions on gatherings,Mongolia,MNG,25368.31,kt,2016.0
43,Economics,Volume of exports,C4_Restrictions on gatherings,Mongolia,MNG,-1.36,percent change,2020.0
44,Health,"Prevalence of stunting, height for age (modeled estimate, % of children under 5)",C4_Restrictions on gatherings,Mongolia,MNG,7.1,percent,2020.0
45,Environment,"Electricity production from renewable sources, excluding hydroelectric",C4_Restrictions on gatherings,Mongolia,MNG,170000000.0,kWh,2015.0
46,Governance,Corruption Perceptions Index,C4_Restrictions on gatherings,Mongolia,MNG,35.0,score,2020.0
47,Environment,"Electricity production from oil, gas and coal sources",C4_Restrictions on gatherings,Mongolia,MNG,96.91637946671504,percent of total,2015.0
48,Health,"Prevalence of overweight (modeled estimate, % of children under 5)",C4_Restrictions on gatherings,Mongolia,MNG,10.1,percent,2020.0
49,Health,Prevalence of Depressive disorders,C4_Restrictions on gatherings,Mongolia,MNG,0.040667,percent,2019.0
50,Demographics,Secure Internet servers ,C4_Restrictions on gatherings,Mongolia,MNG,1690.455098914258,per 1 million people,2019.0
51,Governance,Serious assault (rate),C4_Restrictions on gatherings,Mongolia,MNG,10.28,rate,2018.0
52,Economics,Employment in services (% of total employment) (modeled ILO estimate),C4_Restrictions on gatherings,Mongolia,MNG,53.6209984,Percentage of total employment,2020.0
53,Health,Prevalence of Respiratory infections and tuberculosis,C4_Restrictions on gatherings,Mongolia,MNG,0.294137,percent,2019.0
54,Governance,Human Development Index,C4_Restrictions on gatherings,Mongolia,MNG,0.737,index,2019.0
55,Social issues ,Coverage of social safety net programs (% of population),C4_Restrictions on gatherings,Mongolia,MNG,86.02642778,proportion,2016.0
56,Demographics,Fixed telephone subscriptions,C4_Restrictions on gatherings,Mongolia,MNG,395922.0,number,2019.0
57,Health,Prevalence of chronic kidney disease,C4_Restrictions on gatherings,Mongolia,MNG,0.088394,percent,2019.0
58,Social issues ,Coverage of unemployment benefits and ALMP (% of population),C4_Restrictions on gatherings,Mongolia,MNG,6.490248245,proportion,2016.0
59,Health,Prevalence of down syndrome,C4_Restrictions on gatherings,Mongolia,MNG,0.000225,percent,2019.0
60,Environment,"Energy imports, net ",C4_Restrictions on gatherings,Mongolia,MNG,-168.0933932497473,percent of energy use,2014.0
61,Demographics,Rural population (% of total population),C4_Restrictions on gatherings,Mongolia,MNG,31.45699999999999,proportion,2019.0
62,Demographics,"Age dependency ratio, old (% of working-age population)",C4_Restrictions on gatherings,Mongolia,MNG,6.443900535970293,proportion,2019.0
63,Governance,"CPIA transparency, accountability, and corruption in the public sector rating (1=low to 6=high)",C4_Restrictions on gatherings,Mongolia,MNG,3.0,rating,2019.0
64,Health,Prevalence of obesity,C4_Restrictions on gatherings,Mongolia,MNG,20.6,percent,2016.0
65,Governance,Political stability and absence of violence/terrorism estimate,C4_Restrictions on gatherings,Mongolia,MNG,0.6434917,score,2019.0
66,Social issues ,Progression to secondary school (%),C4_Restrictions on gatherings,Mongolia,MNG,99.27289,proportion,2017.0
67,Health,"Immunization, measles (% of children ages 12-23 months)",C4_Restrictions on gatherings,Mongolia,MNG,98.0,percent,2019.0
68,Environment,Fossil fuel energy consumption,C4_Restrictions on gatherings,Mongolia,MNG,93.19938,percent of total,2014.0
69,Economics,"Labor force participation rate, female (% of female population ages 15+) (modeled ILO estimate)",C4_Restrictions on gatherings,Mongolia,MNG,53.0779991,Percentage of females of the total population,2020.0
71,Environment,Access to electricity ,C4_Restrictions on gatherings,Mongolia,MNG,98.1,percent of population,2018.0
72,Governance,Control of corruption estimate,C4_Restrictions on gatherings,Mongolia,MNG,-0.4417607,score,2019.0
74,Health,Mortality due to COVID-19,C4_Restrictions on gatherings,Mongolia,MNG,0.0,"Number (cumulative total by Dec 26,2020)",2020.0
76,Economics,Unemployment rate (%) - Annual,C4_Restrictions on gatherings,Mongolia,MNG,10.2,percent,2019.0
77,Demographics,People using at least basic sanitation services (% of population),C4_Restrictions on gatherings,Mongolia,MNG,58.4793927670345,proportion,2017.0
78,Health,"Prevalence of HIV, total (% of population ages 15-49)",C4_Restrictions on gatherings,Mongolia,MNG,0.1,percent,2019.0
79,Environment,Combustible renewables and waste,C4_Restrictions on gatherings,Mongolia,MNG,1.722774,percent of total energy,2014.0
80,Economics,"International tourism, receipts",C4_Restrictions on gatherings,Mongolia,MNG,513000000.0,US Dollar,2019.0
81,Environment,"PM2.5 air pollution, mean annual exposure",C4_Restrictions on gatherings,Mongolia,MNG,40.11285,micrograms per cubic meter,2017.0
82,Economics,"Trade, total as % of GDP",C4_Restrictions on gatherings,Mongolia,MNG,99.23697,percent,2019.0
83,Demographics,Refugee population by country or territory of asylum,C4_Restrictions on gatherings,Mongolia,MNG,5.0,proportion,2018.0
84,Social issues ,Proportion of population spending more than 10% of household consumption or income on out-of-pocket health care expenditure (%),C4_Restrictions on gatherings,Mongolia,MNG,2.36407566070557,proportion,2014.0
85,Social issues ,Proportion of women in managerial positions (%),C4_Restrictions on gatherings,Mongolia,MNG,39.01,percent,2018.0
87,Demographics,Age dependency ratio (% of working-age population),C4_Restrictions on gatherings,Mongolia,MNG,53.81684486240186,proportion,2019.0
88,Demographics,People using safely managed drinking water services (% of population),C4_Restrictions on gatherings,Mongolia,MNG,23.7220805652873,proportion,2017.0
89,Governance,Voice and accountability estimate,C4_Restrictions on gatherings,Mongolia,MNG,0.3489689,score,2019.0
90,Economics,Expenditure on social protection (% of GDP),C4_Restrictions on gatherings,Mongolia,MNG,7.45109,percent,2019.0
91,Environment,Energy use (kg of oil equivalent per capita),C4_Restrictions on gatherings,Mongolia,MNG,1828.103253349877,kg of oil equivalent per capita,2014.0
93,Social issues ,"Primary completion rate, total (% of relevant age group)",C4_Restrictions on gatherings,Mongolia,MNG,101.779647827148,proportion,2018.0
95,Demographics,"Population, total",C4_Restrictions on gatherings,Mongolia,MNG,3225167.0,total,2019.0
98,Demographics,Urban population (% of total population),C4_Restrictions on gatherings,Mongolia,MNG,68.543,total,2019.0
99,Economics,"Output per worker (GDP constant 2011 international $ in PPP -- ILO modelled estimates, Nov. 2019",C4_Restrictions on gatherings,Mongolia,MNG,34446.2,international $ in PPP,2020.0
103,Economics,Expenditure on education (% of GDP),C4_Restrictions on gatherings,Mongolia,MNG,3.73087,percent,2019.0
104,Economics,Expenditure on health (% of GDP),C4_Restrictions on gatherings,Mongolia,MNG,2.41063,percent,2019.0
106,Economics,"Lending interest rates, percent per annum",C4_Restrictions on gatherings,Mongolia,MNG,16.92295,percent per annum,2019.0
109,Economics,"Foreign direct investment, net",C4_Restrictions on gatherings,Mongolia,MNG,2443343100.0,US Dollar,2019.0
110,Economics,Growth rates of household expenditure or income per capita (%),C4_Restrictions on gatherings,Mongolia,MNG,1.0,percent,2018.0
112,Environment,Electricity production from nuclear sources ,C4_Restrictions on gatherings,Mongolia,MNG,0.0,percent of total,2014.0
113,Health,Hospital beds (per 10 000 population),C4_Restrictions on gatherings,Mongolia,MNG,80.0,Ones,2017.0
114,Social issues ,"Literacy rate, adult total (% of people ages 15 and above)",C4_Restrictions on gatherings,Mongolia,MNG,98.4231185913086,proportion,2018.0
115,Social issues ,Proportion of population pushed below the $1.90 ($ 2011 PPP) poverty line by out-of-pocket health care expenditure (%),C4_Restrictions on gatherings,Mongolia,MNG,0.241170898079872,proportion,2014.0
116,Social issues ,Proportion of people living below 50 percent of median income (%),C4_Restrictions on gatherings,Mongolia,MNG,9.9,proportion,2018.0
117,Demographics,People with basic handwashing facilities including soap and water (% of population),C4_Restrictions on gatherings,Mongolia,MNG,71.1795489061304,proportion,2017.0
