rank,Category,Indicator,Policy,Country,ISO,value,unit,year
1,Demographics,Individuals using the Internet,H1_Public information campaigns,Togo,TGO,12.3602,percent of population,2019.0
3,Governance,Regulatory quality estimate,H1_Public information campaigns,Togo,TGO,-0.6789817,score,2019.0
5,Demographics,Fixed telephone subscriptions,H1_Public information campaigns,Togo,TGO,43605.0,number,2019.0
7,Health,Prevalence of COVID-19,H1_Public information campaigns,Togo,TGO,3315.0,"Number (cumulative total by Dec 26,2020)",2020.0
8,Health,Prevalence of Diabetes,H1_Public information campaigns,Togo,TGO,0.016206,percent,2019.0
9,Economics,Volume of imports,H1_Public information campaigns,Togo,TGO,7.106,percent change,2020.0
10,Health,Prevalence of total cancers,H1_Public information campaigns,Togo,TGO,0.002132,percent,2019.0
11,Demographics,Fixed broadband subscriptions,H1_Public information campaigns,Togo,TGO,0.394674,per 100 people,2019.0
12,Health,Summary exposure value tobacco,H1_Public information campaigns,Togo,TGO,13.87609,Rate (risk-weighted prevalence),2019.0
13,Health,"Incidence of tuberculosis (per 100,000 people)",H1_Public information campaigns,Togo,TGO,37.0,Cases,2019.0
14,Health,Prevalence of Depressive disorders,H1_Public information campaigns,Togo,TGO,0.035646,percent,2019.0
15,Environment,Energy use (kg of oil equivalent per capita),H1_Public information campaigns,Togo,TGO,462.4909480909,kg of oil equivalent per capita,2014.0
16,Economics,"Labor force participation rate, total (% of total population ages 15+) (modeled ILO estimate)",H1_Public information campaigns,Togo,TGO,77.473999,Percentage of total population,2020.0
17,Health,"Nurses and midwives (per 1,000 people)",H1_Public information campaigns,Togo,TGO,0.4102,Ones,2018.0
18,Social issues ,Net migration,H1_Public information campaigns,Togo,TGO,-9999.0,net total / data are 5 year estimates,2019.0
19,Governance,Human Freedom Score ,H1_Public information campaigns,Togo,TGO,6.13,score,2018.0
20,Economics,Volume of exports,H1_Public information campaigns,Togo,TGO,8.136,percent change,2020.0
21,Governance,Government effectiveness estimate,H1_Public information campaigns,Togo,TGO,-0.9173347,score,2019.0
22,Social issues ,Proportion of women in managerial positions (%),H1_Public information campaigns,Togo,TGO,29.84,percent,2015.0
24,Health,Prevalence of down syndrome,H1_Public information campaigns,Togo,TGO,0.000161,percent,2019.0
25,Health,Prevalence of chronic kidney disease,H1_Public information campaigns,Togo,TGO,0.042989,percent,2019.0
26,Environment,Electricity production from oil sources,H1_Public information campaigns,Togo,TGO,24.69135802469136,percent of total,2015.0
27,Health,Prevalence of anxiety disorders,H1_Public information campaigns,Togo,TGO,0.034472,percent,2019.0
28,Governance,Political stability and absence of violence/terrorism estimate,H1_Public information campaigns,Togo,TGO,-0.805393,score,2019.0
29,Governance,Aggregate score for the Civil Liberties category,H1_Public information campaigns,Togo,TGO,28.0,score,2021.0
30,Demographics,Mobile cellular subscriptions,H1_Public information campaigns,Togo,TGO,77.195,per 100 people,2019.0
31,Environment,Energy use ,H1_Public information campaigns,Togo,TGO,329.3783198317994,"(kg of oil equivalent) per $1,000 GDP (constant 2017 PPP)",2014.0
32,Health,"Physicians (per 1,000 people)",H1_Public information campaigns,Togo,TGO,0.0774,Ones,2018.0
33,Governance,Economic Freedom Score,H1_Public information campaigns,Togo,TGO,6.25,score,2018.0
35,Environment,CO2 emissions (kt),H1_Public information campaigns,Togo,TGO,2999.606,kt,2016.0
36,Social issues ,Life Ladder ,H1_Public information campaigns,Togo,TGO,4.106800079345703,score,2021.0
37,Health,"Prevalence of HIV, total (% of population ages 15-49)",H1_Public information campaigns,Togo,TGO,2.2,percent,2019.0
38,Governance,Voice and accountability estimate,H1_Public information campaigns,Togo,TGO,-0.7209277,score,2019.0
39,Environment,"Adjusted net savings, including particulate emission damage",H1_Public information campaigns,Togo,TGO,1.0887765083884,percent of GNI,2018.0
40,Health,Prevalence of Respiratory infections and tuberculosis,H1_Public information campaigns,Togo,TGO,0.239652,percent,2019.0
41,Environment,Fossil fuel energy consumption,H1_Public information campaigns,Togo,TGO,17.80063,percent of total,2014.0
42,Governance,Control of corruption estimate,H1_Public information campaigns,Togo,TGO,-0.7497168,score,2019.0
43,Economics,"Unemployment, total (% of total labor force) (modeled ILO estimate)",H1_Public information campaigns,Togo,TGO,2.00500011,percent of total labor force,2020.0
44,Health,Prevalence of obesity,H1_Public information campaigns,Togo,TGO,8.4,percent,2016.0
45,Health,Prevalence of Hypertensive heart disease,H1_Public information campaigns,Togo,TGO,0.000863,percent,2019.0
46,Governance,Corruption Perceptions Index,H1_Public information campaigns,Togo,TGO,29.0,score,2020.0
47,Governance,Fragile States Index Total ,H1_Public information campaigns,Togo,TGO,85.84143116430509,score,2020.0
48,Environment,Renewable energy consumption ,H1_Public information campaigns,Togo,TGO,71.2646671412409,percent of total final energy consumption,2015.0
49,Health,"Immunization, DPT (% of children ages 12-23 months)",H1_Public information campaigns,Togo,TGO,84.0,percent,2019.0
50,Environment,Electricity production from nuclear sources ,H1_Public information campaigns,Togo,TGO,0.0,percent of total,2014.0
52,Social issues ,Press freedom score,H1_Public information campaigns,Togo,TGO,29.33,score,2020.0
53,Health,Domestic General Government Health Expenditure (GGHE-D) as % General Government Expenditure (GGE),H1_Public information campaigns,Togo,TGO,1.1,percent,2018.0
54,Governance,Human Development Index,H1_Public information campaigns,Togo,TGO,0.515,index,2019.0
56,Economics,Employment in services (% of total employment) (modeled ILO estimate),H1_Public information campaigns,Togo,TGO,49.9319992,Percentage of total employment,2020.0
57,Social issues ,Proportion of seats held by women in national parliaments (%),H1_Public information campaigns,Togo,TGO,18.68131868,proportion,2020.0
58,Environment,"PM2.5 air pollution, mean annual exposure",H1_Public information campaigns,Togo,TGO,35.73134,micrograms per cubic meter,2017.0
59,Environment,Combustible renewables and waste,H1_Public information campaigns,Togo,TGO,44.13321,percent of total energy,2014.0
60,Health,"Immunization, measles (% of children ages 12-23 months)",H1_Public information campaigns,Togo,TGO,75.0,percent,2019.0
61,Health,Mortality due to COVID-19,H1_Public information campaigns,Togo,TGO,66.0,"Number (cumulative total by Dec 26,2020)",2020.0
62,Health,"Prevalence of overweight (modeled estimate, % of children under 5)",H1_Public information campaigns,Togo,TGO,2.4,percent,2020.0
63,Environment,CO2 emissions (metric tons per capita),H1_Public information campaigns,Togo,TGO,0.399417,metric tons per capita,2016.0
65,Social issues ,Gini index (World Bank estimate),H1_Public information campaigns,Togo,TGO,43.1,index ,2015.0
67,Environment,Access to electricity ,H1_Public information campaigns,Togo,TGO,51.3452835083008,percent of population,2018.0
68,Environment,"Electricity production from renewable sources, excluding hydroelectric",H1_Public information campaigns,Togo,TGO,5000000.0,kWh,2015.0
69,Health,"Prevalence of stunting, height for age (modeled estimate, % of children under 5)",H1_Public information campaigns,Togo,TGO,23.8,percent,2020.0
72,Economics,"Labor force participation rate, female (% of female population ages 15+) (modeled ILO estimate)",H1_Public information campaigns,Togo,TGO,76.0569992,Percentage of females of the total population,2020.0
74,Governance,"CPIA transparency, accountability, and corruption in the public sector rating (1=low to 6=high)",H1_Public information campaigns,Togo,TGO,3.0,rating,2019.0
75,Environment,Electric power consumption ,H1_Public information campaigns,Togo,TGO,154.6652373207778,kWh per capita,2014.0
78,Environment,"Electricity production from oil, gas and coal sources",H1_Public information campaigns,Togo,TGO,24.69135802469136,percent of total,2015.0
79,Governance,Rule of law estimate ,H1_Public information campaigns,Togo,TGO,-0.5887967,score,2019.0
83,Governance,Aggregate score for the Political Rights category,H1_Public information campaigns,Togo,TGO,15.0,score,2021.0
85,Demographics,Secure Internet servers ,H1_Public information campaigns,Togo,TGO,19.67245729777642,per 1 million people,2019.0
87,Governance,Total freedom in the world score ,H1_Public information campaigns,Togo,TGO,43.0,score,2021.0
90,Environment,"Energy imports, net ",H1_Public information campaigns,Togo,TGO,19.97162294748761,percent of energy use,2014.0
103,Environment,"PM2.5 air pollution, population exposed to levels exceeding WHO guideline value ",H1_Public information campaigns,Togo,TGO,100.0,percent of total,2017.0
109,Environment,Electricity production from coal sources ,H1_Public information campaigns,Togo,TGO,0.0,percent of total,2015.0
116,Governance,Personal Freedom Score ,H1_Public information campaigns,Togo,TGO,6.01,score,2018.0
