rank,Category,Indicator,Policy,Country,ISO,value,unit,year
33,Governance,Rule of law estimate ,C2_Workplace closing,Anguilla,AIA,0.3557367,score,2019.0
34,Governance,Control of corruption estimate,C2_Workplace closing,Anguilla,AIA,1.234392,score,2019.0
42,Health,Mortality due to COVID-19,C2_Workplace closing,Anguilla,AIA,0.0,"Number (cumulative total by Dec 26,2020)",2020.0
53,Governance,Regulatory quality estimate,C2_Workplace closing,Anguilla,AIA,0.8462311,score,2019.0
67,Governance,Government effectiveness estimate,C2_Workplace closing,Anguilla,AIA,0.8158239,score,2019.0
71,Governance,Political stability and absence of violence/terrorism estimate,C2_Workplace closing,Anguilla,AIA,1.367357,score,2019.0
73,Health,Prevalence of COVID-19,C2_Workplace closing,Anguilla,AIA,10.0,"Number (cumulative total by Dec 26,2020)",2020.0
