rank,Category,Indicator,Policy,Country,ISO,value,unit,year
1,Demographics,Individuals using the Internet,C2_Workplace closing,United Kingdom,GBR,92.5166,percent of population,2019.0
2,Economics,"Unemployment, total (% of total labor force) (modeled ILO estimate)",C2_Workplace closing,United Kingdom,GBR,4.11499977,percent of total labor force,2020.0
4,Governance,Personal Freedom Score ,C2_Workplace closing,United Kingdom,GBR,8.79,score,2018.0
5,Environment,Electric power consumption ,C2_Workplace closing,United Kingdom,GBR,5130.390253300277,kWh per capita,2014.0
6,Governance,Aggregate score for the Civil Liberties category,C2_Workplace closing,United Kingdom,GBR,54.0,score,2021.0
8,Environment,Electricity production from oil sources,C2_Workplace closing,United Kingdom,GBR,0.6341495320434302,percent of total,2015.0
9,Social issues ,Press freedom score,C2_Workplace closing,United Kingdom,GBR,22.93,score,2020.0
10,Health,Prevalence of Diabetes,C2_Workplace closing,United Kingdom,GBR,0.136351,percent,2019.0
11,Demographics,Fixed broadband subscriptions,C2_Workplace closing,United Kingdom,GBR,39.597,per 100 people,2019.0
12,Environment,Electricity production from nuclear sources ,C2_Workplace closing,United Kingdom,GBR,20.91385317936948,percent of total,2015.0
13,Health,"Immunization, DPT (% of children ages 12-23 months)",C2_Workplace closing,United Kingdom,GBR,93.0,percent,2019.0
14,Health,"Nurses and midwives (per 1,000 people)",C2_Workplace closing,United Kingdom,GBR,8.1723,Ones,2018.0
15,Social issues ,Life Ladder ,C2_Workplace closing,United Kingdom,GBR,7.063600063323975,score,2021.0
17,Environment,Electricity production from coal sources ,C2_Workplace closing,United Kingdom,GBR,22.80649074195198,percent of total,2015.0
18,Health,Summary exposure value tobacco,C2_Workplace closing,United Kingdom,GBR,25.35924,Rate (risk-weighted prevalence),2019.0
19,Health,Prevalence of chronic kidney disease,C2_Workplace closing,United Kingdom,GBR,0.090669,percent,2019.0
20,Health,Prevalence of down syndrome,C2_Workplace closing,United Kingdom,GBR,0.000738,percent,2019.0
21,Social issues ,Net migration,C2_Workplace closing,United Kingdom,GBR,1303250.0,net total / data are 5 year estimates,2019.0
22,Health,Prevalence of anxiety disorders,C2_Workplace closing,United Kingdom,GBR,0.049807,percent,2019.0
23,Economics,"Labor force participation rate, total (% of total population ages 15+) (modeled ILO estimate)",C2_Workplace closing,United Kingdom,GBR,62.7649994,Percentage of total population,2020.0
24,Demographics,Fixed telephone subscriptions,C2_Workplace closing,United Kingdom,GBR,31973300.0,number,2019.0
25,Environment,"PM2.5 air pollution, mean annual exposure",C2_Workplace closing,United Kingdom,GBR,10.47269,micrograms per cubic meter,2017.0
27,Economics,Volume of imports,C2_Workplace closing,United Kingdom,GBR,1.242,percent change,2020.0
28,Economics,"Labor force participation rate, female (% of female population ages 15+) (modeled ILO estimate)",C2_Workplace closing,United Kingdom,GBR,57.6860008,Percentage of females of the total population,2020.0
29,Demographics,Secure Internet servers ,C2_Workplace closing,United Kingdom,GBR,35989.50271196399,per 1 million people,2019.0
30,Environment,"Adjusted net savings, including particulate emission damage",C2_Workplace closing,United Kingdom,GBR,3.0392590611375,percent of GNI,2018.0
31,Environment,"Electricity production from renewable sources, excluding hydroelectric",C2_Workplace closing,United Kingdom,GBR,77262000000.0,kWh,2015.0
32,Health,"Physicians (per 1,000 people)",C2_Workplace closing,United Kingdom,GBR,2.8117,Ones,2018.0
33,Governance,Rule of law estimate ,C2_Workplace closing,United Kingdom,GBR,1.600911,score,2019.0
34,Governance,Control of corruption estimate,C2_Workplace closing,United Kingdom,GBR,1.774812,score,2019.0
35,Health,Domestic General Government Health Expenditure (GGHE-D) as % General Government Expenditure (GGE),C2_Workplace closing,United Kingdom,GBR,7.9,percent,2018.0
36,Environment,Renewable energy consumption ,C2_Workplace closing,United Kingdom,GBR,8.71168557437913,percent of total final energy consumption,2015.0
37,Health,Prevalence of Hypertensive heart disease,C2_Workplace closing,United Kingdom,GBR,0.001117,percent,2019.0
38,Economics,Employment in services (% of total employment) (modeled ILO estimate),C2_Workplace closing,United Kingdom,GBR,81.3379974,Percentage of total employment,2020.0
39,Economics,Volume of exports,C2_Workplace closing,United Kingdom,GBR,1.775,percent change,2020.0
40,Environment,Fossil fuel energy consumption,C2_Workplace closing,United Kingdom,GBR,80.35177,percent of total,2015.0
41,Governance,Fragile States Index Total ,C2_Workplace closing,United Kingdom,GBR,38.260475361020404,score,2020.0
42,Health,Mortality due to COVID-19,C2_Workplace closing,United Kingdom,GBR,66541.0,"Number (cumulative total by Dec 26,2020)",2020.0
44,Governance,Aggregate score for the Political Rights category,C2_Workplace closing,United Kingdom,GBR,39.0,score,2021.0
45,Governance,Total freedom in the world score ,C2_Workplace closing,United Kingdom,GBR,93.0,score,2021.0
47,Governance,Economic Freedom Score,C2_Workplace closing,United Kingdom,GBR,8.08,score,2018.0
48,Governance,Serious assault (rate),C2_Workplace closing,United Kingdom,GBR,925.4,rate,2018.0
49,Environment,CO2 emissions (kt),C2_Workplace closing,United Kingdom,GBR,379024.8,kt,2016.0
50,Demographics,Mobile cellular subscriptions,C2_Workplace closing,United Kingdom,GBR,117.549,per 100 people,2019.0
51,Health,"Immunization, measles (% of children ages 12-23 months)",C2_Workplace closing,United Kingdom,GBR,91.0,percent,2019.0
52,Social issues ,"Intentional homicides (per 100,000 people)",C2_Workplace closing,United Kingdom,GBR,1.2049147774,"proportion, pero 100,000 people",2018.0
53,Governance,Regulatory quality estimate,C2_Workplace closing,United Kingdom,GBR,1.625853,score,2019.0
54,Governance,Voice and accountability estimate,C2_Workplace closing,United Kingdom,GBR,1.263675,score,2019.0
55,Environment,"Electricity production from oil, gas and coal sources",C2_Workplace closing,United Kingdom,GBR,53.18085599781184,percent of total,2015.0
56,Governance,Human Development Index,C2_Workplace closing,United Kingdom,GBR,0.932,index,2019.0
58,Health,Prevalence of Depressive disorders,C2_Workplace closing,United Kingdom,GBR,0.050213,percent,2019.0
60,Social issues ,Gini index (World Bank estimate),C2_Workplace closing,United Kingdom,GBR,34.8,index ,2016.0
61,Environment,Combustible renewables and waste,C2_Workplace closing,United Kingdom,GBR,2.79409,percent of total energy,2015.0
64,Environment,"Energy imports, net ",C2_Workplace closing,United Kingdom,GBR,34.62999026752639,percent of energy use,2015.0
65,Health,Prevalence of total cancers,C2_Workplace closing,United Kingdom,GBR,0.035098,percent,2019.0
67,Governance,Government effectiveness estimate,C2_Workplace closing,United Kingdom,GBR,1.435909,score,2019.0
68,Environment,Energy use (kg of oil equivalent per capita),C2_Workplace closing,United Kingdom,GBR,2764.516671338058,kg of oil equivalent per capita,2015.0
69,Environment,CO2 emissions (metric tons per capita),C2_Workplace closing,United Kingdom,GBR,5.776796,metric tons per capita,2016.0
70,Social issues ,Proportion of seats held by women in national parliaments (%),C2_Workplace closing,United Kingdom,GBR,33.84615385,proportion,2020.0
71,Governance,Political stability and absence of violence/terrorism estimate,C2_Workplace closing,United Kingdom,GBR,0.5191886,score,2019.0
72,Health,Prevalence of Respiratory infections and tuberculosis,C2_Workplace closing,United Kingdom,GBR,0.129437,percent,2019.0
73,Health,Prevalence of COVID-19,C2_Workplace closing,United Kingdom,GBR,1977171.0,"Number (cumulative total by Dec 26,2020)",2020.0
74,Governance,Corruption Perceptions Index,C2_Workplace closing,United Kingdom,GBR,77.0,score,2020.0
75,Environment,"PM2.5 air pollution, population exposed to levels exceeding WHO guideline value ",C2_Workplace closing,United Kingdom,GBR,66.5332490328298,percent of total,2017.0
78,Health,"Incidence of tuberculosis (per 100,000 people)",C2_Workplace closing,United Kingdom,GBR,8.0,Cases,2019.0
81,Environment,Energy use ,C2_Workplace closing,United Kingdom,GBR,61.63952738470469,"(kg of oil equivalent) per $1,000 GDP (constant 2017 PPP)",2015.0
83,Economics,"Central government debt, total",C2_Workplace closing,United Kingdom,GBR,114.9722447592783,percent of GDP,2016.0
85,Governance,Human Freedom Score ,C2_Workplace closing,United Kingdom,GBR,8.44,score,2018.0
98,Health,COVID-19 vaccine administered,C2_Workplace closing,United Kingdom,GBR,1416933.0,"Number (cumulative total by Dec 26,2020)",2020.0
117,Environment,Access to electricity ,C2_Workplace closing,United Kingdom,GBR,100.0,percent of population,2018.0
