rank,Category,Indicator,Policy,Country,ISO,value,unit,year
3,Governance,Regulatory quality estimate,E2_Debt/contract relief,Anguilla,AIA,0.8462311,score,2019.0
9,Health,Prevalence of COVID-19,E2_Debt/contract relief,Anguilla,AIA,10.0,"Number (cumulative total by Dec 26,2020)",2020.0
49,Health,Mortality due to COVID-19,E2_Debt/contract relief,Anguilla,AIA,0.0,"Number (cumulative total by Dec 26,2020)",2020.0
50,Governance,Control of corruption estimate,E2_Debt/contract relief,Anguilla,AIA,1.234392,score,2019.0
55,Governance,Government effectiveness estimate,E2_Debt/contract relief,Anguilla,AIA,0.8158239,score,2019.0
65,Governance,Political stability and absence of violence/terrorism estimate,E2_Debt/contract relief,Anguilla,AIA,1.367357,score,2019.0
71,Governance,Rule of law estimate ,E2_Debt/contract relief,Anguilla,AIA,0.3557367,score,2019.0
